event_key,name,active,event_start,event_end,event_type,event_subtype,seats,description,speakers,moderators,artists,sponsors,exhibitors,volunteers,venue,address,media_url,company,audience,subject,geo_area,tags,host_org,rsvp_url,surveys
1,SuperFight Anime edition,Y,11/11/2016 1:00 PM,11/11/2016 3:00 PM,Card Game,,,Like to watch anime and like to argue which character would win in a fight then pick your character and equipment and let the fight begin.,,Gary Utecht,,,,,Gaming Table 1,,,,,,,,,,y
10,Super Smash Bros Melee Tournament,Y,11/12/2016 6:00 PM,11/12/2016 9:00 PM,Video Game,,,"Super Smash Bros 4 and Super Smash Bros Melee singles tournament. Double elimination, standard tournament rules apply. &nbsp;See the following bracket :&nbsp;<a href=""http://challonge.com/MeleeNanoCon"" target=""_blank"">http://challonge.com/MeleeNanoCon</a>",,Alex Van Keulen,,,,,Console Projector 1,,,,,,,,E-Sports Club,,y
11,Virtual Reality Demo,Y,11/12/2016 9:00 AM,11/13/2016 10:00 AM,Virtual Reality,,,"I would host a demo of Virtual Reality games using the HTC vive and Oculus Rift. Ideally, I would have a space of about 20ft by 20ft, to allow clearance for movement within the virtual space. I can work with less, preferably no less than 9x9 ft for the playspace and a separate table to host my computer/monitor/sign up sheets. I would have a schedule with sign up sheets and various game options for attendees to try out. I would host two stations, one sitting experience at the table with my desktop (and laptop) and another in the open space cleared for VR play using the HTC vive. I would have time slots of 15 minutes per person, so I could host about 8 people per hour, one on the seated Rift experience, one on the Vive movement experience.",,Chris Andersen,,,,,Theater,,,,,,,,,,y
12,Hero Quest,Y,11/12/2016 10:00 AM,11/12/2016 12:00 PM,Board Game,,,"Enter the World of Hero Quest...If You Dare! It's like no other game you've ever played! Dark caverns. Gory monsters. Deadly traps...and worse! Once you enter the mysterious underground world of Hero Quest, there's no turning back. Which daring hero will you be? THE BARBARIAN: The mightiest warrior! Few can match him in mortal combat! THE ELF: A proud champion with fighting skills matched only by his magic! THE WIZARD: A master of sorcery. His knowledge and use of magic is unrivaled. THE DWARF: A fearless fighter with a unique ability to disarm traps. Your first Quest is about to begin! Will the evil forces of doom be stopped? Will the land be saved from destruction? It's all up to you. Good luck!",,,,,,,Gaming Table 1,,,,,,,,,,y
13,Settlers of America: Trails to Rails,Y,11/12/2016 1:00 PM,11/12/2016 3:00 PM,Board Game,,,"The 19th Century has arrived and America is heading west. Wagon trains form on the frontier. Settlers seeking fresh lives and opportunities strike out to tame wild lands and build new cities. These new cities rely on young railroads for vital goods. Trails become rails and create great wealth. While the crowded East still offers options, its resources dwindle. Look west to make your fortune. Smart money seeks rich, unclaimed land and hungry new markets. Finance your settlers as they head west to build capitals of tomorrow. Link these cities with rails of steel. Operate your railroad to supply the townsfolk with goods. Go west. Settle the wide, open land. Claim your destiny. Settlers of America, Trails to Rails utilizes the simple, fun Catan hex-tile grid to map the young United States. Collect and trade resources in order to purchase and move settlers, build cities, lay rails and acquire and move trains. Create rail links to acquire gold, which lets you buy resources and use opponents' rails. Use trains to distribute goods to rival cities. But, as your settlers populate the West, they deplete the resources of the East. Still, your options always abound.",,,,,,,Gaming Table 1,,,,,,,,,,y
14,Closet Cosplay with Cassandra Rain,Y,11/12/2016 2:00 PM,11/12/2016 3:00 PM,Panel,,,Closet cosplay is a panel that focuses on great ways to save money while still portraying characters you love. During this hour Cassandra Rain will have many different examples of closet cosplay she has put together. Come talk tips with her and hopefully get inspired to start cosplaying!,,Cassandra Nixon,,,,,Gaming Table 3,,,,,,,,Cassandra Rain,,y
15,D&D Adventures League DDAL 4-10 The Artifact (Level 5-10),Y,11/10/2016 1:00 PM,11/10/2016 5:00 PM,Role Playing,,,An expedition to the Amber Temple reveals another major minion of the enemy and uncovers a secret weapon that may help defeat them. Part ten of Misty Fortunes and Absent Hearts. Level 5-10,,Kevin Engling,,,,,RPGA Table 2,,,,,,,,,,y
16,D&D Adventures League DDAL 4-11 The Donjon (Level 5-10)),Y,11/10/2016 7:00 PM,11/10/2016 11:00 PM,Role Playing,,,The village of Ora?nou is panicked when a group of Bloodhand orcs appear at the edge of the woods. They bring news and an unusual request that reveals a new foe. Part eleven of Misty Fortunes and Absent Hearts. Level 5-10,,Kevin Engling,,,,,RPGA Table 2,,,,,,,,,,y
17,D&D Adventures League DDAL 4-12 The Raven (Level 5-10),Y,11/11/2016 9:00 AM,11/11/2016 1:00 PM,Role Playing,,,The Bloodhand orcs have a prisoner that may hold the answers to the strange goings on and the key to stopping the enemy. Now you just have to convince them to hand the prisoner over. Part twelve of Misty Fortunes and Absent Hearts. Level 5-10,,Kevin Engling,,,,,RPGA Table 2,,,,,,,,,,y
18,D&D Adventures League DDAL 4-13 The Horsemen (Level 5-10),Y,11/11/2016 2:00 PM,11/11/2016 6:00 PM,Role Playing,,,The unexpected ally imparts the secret you have been searching for and now only one more puppet remains before you can finally face the enemy. Unfortunately your allies begin to pay the price for your interference in the enemy's plans. Part thirteen of Misty Fortunes and Absent Hearts. Level 5-10,,Kevin Engling,,,,,RPGA Table 2,,,,,,,,,,y
19,D&D Adventuers League DDAL 4-14 The Dark Lord (Level 5-10),Y,11/11/2016 7:00 PM,11/11/2016 11:00 PM,Role Playing,,,"The enemy is revealed, but time is short and if you are not successful in your mission to Mount Baratok, love will never die. Part fourteen and the finale of Misty Fortunes and Absent Hearts. Level 5-10",,Kevin Engling,,,,,RPGA Table 2,,,,,,,,,,y
2,Game of Thrones Board Game,Y,11/13/2016 12:00 PM,11/13/2016 3:00 PM,Board Game,,,"Lead one of six of the most iconic families of Westeros in their bid to gain control of the Iron Throne, no matter what it takes.",,Zachary Truesdell,,,,,Gaming Table 1,,,,,,,,,,y
20,D&D Adventures League DDEX 3-16 Assault on Maerimydra (Level 11-16),Y,11/12/2016 9:00 AM,11/12/2016 5:00 PM,Role Playing,,,"The time has come for the brave and the bold to put an end to the machinations of Maerimydra's demonic occupiers and their fiendish fire giant ruler. This will be no mean feat; the city is a cesspit of corruption and madness. You will have help, however, as an unlikely group of allies have gathered to your side in the Underdark beneath Faer&ucirc;n. Danger, glory, and redemption await those brave enough to seize it. Level 11-16",,Kevin Engling,,,,,RPGA Table 2,,,,,,,,,,y
21,D&D Adventures League DDEX 2-3 The Drowned Tower (Level 5-10),Y,11/12/2016 7:00 PM,11/12/2016 11:00 PM,Role Playing,,,"You are approached by someone claiming to be a member of the Brotherhood of the Cloak investigating unusual incidents involving some of his brethren. Discretion is vital, as there is rumored to be a link between the denizens of the Tower of Arcane Might and one of the elemental cults. Can you uncover the truth? Level 5-10",,Kevin Engling,,,,,RPGA Table 2,,,,,,,,,,y
22,D&D Adventures League DDEX 2-13 The Howling Void (Level 5-10),Y,11/13/2016 9:00 AM,11/13/2016 1:00 PM,Role Playing,,,"A bastion of the Cult of the Howling Wind has been located beneath the Monastery of the Yellow Rose in the bowels of the Earthspur Mountains. In order to thwart the cult's plans for Mulmaster's destruction, you must delve into the depths and quell the storm within. While their winds still blow, none in Mulmaster are truly safe. Level 5-10",,Kevin Engling,,,,,RPGA Table 2,,,,,,,,,,y
23,D&D Adventures League CORE 1-1 A Scream in the Night (Level 1-4),Y,11/11/2016 9:00 AM,11/11/2016 1:00 PM,Role Playing,,,"Melvaunt is a city of merchants and metalsmiths. The docks are constantly filled with ships from Hillsfar, Mulmaster, and more distant ports. The northern coast of the Moonsea is an inhospitable place, and its people have a reputation for being rough and unfriendly. But they don't go around murdering one another in the streets. At least, not usually. Was that a scream you just heard? Part One of The Chaos in Melvaunt. Level 1-4",,Russell Engel - Local Coordinator,,,,,RPGA Table 3,,,,,,,,,,y
24,D&D Adventures League CORE 1-2 A Cog in the Wheel (Level 1-4),Y,11/11/2016 2:00 PM,11/11/2016 6:00 PM,Role Playing,,,"With the identity of a murderer confirmed, heroes are needed to track it down to its home. As it turns out, it might be a longer journey than first imagined.<br /> Part Two of The Chaos in Melvaunt. Level 1-4",,Russell Engel - Local Coordinator,,,,,RPGA Table 3,,,,,,,,,,y
25,D&D Adventures League CORE 1-3 A Hole in the World,Y,11/11/2016 7:00 PM,11/11/2016 11:00 PM,Role Playing,,,Threats from outside Melvaunt and within push heroes to the brink as a terrified populace counts on the bravery of a few heroes to avert total disaster.<br /> Part Three of The Chaos in Melvaunt. Level 1-4,,Russell Engel - Local Coordinator,,,,,RPGA Table 3,,,,,,,,,,y
26,D&D Adventures League PAXW2016 Cloud Giant's Bargain (Level 5-7),Y,11/12/2016 9:00 AM,11/12/2016 1:00 PM,Role Playing,,,"The renowned adventuring company Acquisitions Inc. hires you to infiltrate a castle--but not just any castle. This is a flying fortress built by the cloud giant Count Stratovan, who is currently preparing to destroy the Sword Coast. Your mission is to meet with his son, who claims to want to prevent the war and establish peace between the giants and the small folk. If you can learn whether the son can be trusted, discover the secrets of the castle, and... well, survive, you too can earn acclaim with Acquisitions Inc.! Level 5-7",,Russell Engel - Local Coordinator,,,,,RPGA Table 3,,,,,,,,,,y
27,D&D Adventures League DDEX 1-12 Raiders of the Twilight Marsh (Level 5-10),Y,11/12/2016 2:00 PM,11/12/2016 6:00 PM,Role Playing,,,"A black dragon's treasure horde has been located in the Twilight Marsh, and within it are secrets that hold interest to the factions. With the dragon marauding over the countryside, the horde is left unguarded. Now is the time to plunder its lair! An adventure for 5th-10th level characters.",,Russell Engel - Local Coordinator,,,,,RPGA Table 3,,,,,,,,,,y
28,Smash 4 Tournament,Y,11/12/2016 6:00 PM,11/13/2016 12:00 AM,Video Game,,,Tournament of smash for with a prize pool,,Riley Taborda,,,,,Console Projector 2,,,,,,,,E-Sports,,y
29,Cardfight!! Vanguard Demo,Y,11/11/2016 2:00 PM,11/11/2016 4:00 PM,Card Game,,,"Learn to play the anime-based trading card game Cardfight!! Vanguard. The official website gives it the description :""On a planet much like the Earth called &acirc;&euro;&oelig;Cray&acirc;&euro;ù, you battle your opponent with the help of your units. Cardfighters become Vanguards, and lead their units towards victory!"" No cards are necessary for the demo though, if you have a deck even better!<br /> <br /> http://cf-vanguard.com/en/",,Patrick McGowan,,,,,Gaming Table 3,,,,,,,,,,y
3,Twilight Imperium All Night Long,Y,11/11/2016 10:00 PM,11/12/2016 8:00 AM,Board Game,,,"Twilight Imperium plus the expansion Shattered Empire. We will be starting at 10pm on Friday night, and playing until we have a winner. If you plan to join us for the event, be prepared to be up all night with a very complicated galactic conquest board game. Races of the galaxy will be chosen randomly, and we will discuss what features of the expansion we will use after all players are present. Stay up all night with this unique game, and get more Nanocon in your system this year.",,Lewis Bundy,,,,,Gaming Table 5,,,,,,,,,,y
30,Setup,Y,11/10/2016 3:00 PM,11/10/2016 5:00 PM,Tearing down,,,Set up for Nanocon - doors open at 5pm!,,Rachel Groth,,,,,General Gaming Area,,,,,,,,Nanocon NPC,,y
31,D&D Adventurer's League 5-1 Treasure of the Broken Hoard,Y,11/11/2016 9:00 AM,11/11/2016 1:00 PM,Role Playing,,,"A famous relic hunter seeks adventurers to help her find caches of treasure hidden by the now-<br /> defeated followers of the Cult of the Dragon.<br /> <br /> Her maps and notes may lead the way to great wealth&acirc;&euro;""or a terrible death.<br /> <br /> And do other parties have designs on the treasure as well?<br /> <br /> Five 1-Hour Mini-Adventures for 1st & 2nd Level Characters",,Glenn Berman,,,,,RPGA Table 1,,,,,,,,,,y
32,D&D Adventurer's League 5-2 The Black Road,Y,11/11/2016 2:00 PM,11/11/2016 6:00 PM,Role Playing,,,"Caravans are having a difficult time getting through to Parnast via the Black Road.<br /> <br /> Organized attacks by orcs and other monstrous humanoids working in concert with one another have folks baffled. Little do they know that an unusually intelligent hill giant, going by the name of Bad Fruul is to blame.<br /> <br /> SEER has sent her emissary Hsing, to task your group to accompany a caravan with a very special cargo destined for the Shrine of Axes in Parnast, and to figure out who is responsible.<br /> <br /> A Two Hour Adventure for 1st-4th Level Characters",,Glenn Berman,,,,,RPGA Table 1,,,,,,,,,,y
33,D&D Adventurer's League 5-3 Uninvited Guests,Y,11/11/2016 7:00 PM,11/11/2016 11:00 PM,Role Playing,,,"The Shrine of the Axes has been restored and Raggnar Redtooth, who previously conspired with dragon cultists, is trying to restore his reputation in Parnast by sponsoring a feast.<br /> <br /> There is just one thing he needs, meat for his feast. Game is supposed to be plentiful in the Weathercote Wood, but the townsfolk are all busy with their own work, and the minions of Bad Fruul are still out there causing trouble.<br /> <br /> What can go wrong on a simple hunt?<br /> <br /> A Two-Hour Adventure for 1st-4th Level Characters",,Glenn Berman,,,,,RPGA Table 1,,,,,,,,,,y
34,D&D Adventurer's League 5-4 In Dire Need,Y,11/12/2016 10:00 AM,11/12/2016 1:00 PM,Role Playing,,,"An expedition of dwarf warriors from Citadel Adbar finds itself isolated and besieged by Ice Spire ogres and their allies. They require immediate relief or they risk being destroyed to a dwarf. SEER has directed you to their location in the hopes that you can rescue the dwarves and save their precious cargo, a tablet bearing secrets of ancient rune magic.",,Glenn Berman,,,,,RPGA Table 1,,,,,,,,,,y
35,D&D Adventurer's League 5-5 A Dish Best Served Cold,Y,11/13/2016 10:00 AM,11/13/2016 1:00 PM,Role Playing,,,"Among the Story of Stagwick, giants are a recurring theme, but a long-standing peace with giant-kind is now threatened as a patrol of Blood Riders spark a feud with a local tribe of giants. With word of strange activity coming from the Ice Spires, Good King Hartwick can&acirc;&euro;&trade;t be too careful. Can you quench the giants&acirc;&euro;&trade;s thirst for revenge?<br /> <br /> For character's level 5-10",,Glenn Berman,,,,,RPGA Table 1,,,,,,,,,,y
36,'Into The Deep Dark Depth' Dread Adventure Playtest,Y,11/13/2016 12:00 PM,11/13/2016 3:00 PM,Role Playing,,,"The full moon rose on the equinox and now you and six other Athenian youth have been chosen. Nine years ago your king&acirc;&euro;&trade;s son, Theseus, was sent with the third tribute and did not return. Now you&acirc;&euro;&trade;ve been chosen to be sent to Crete in sacrifice to the monster there. In this dread adventure you must make your way through the maze of the Minotaur. Find Theseus&acirc;&euro;&trade;s equipment and kill the Minotaur deep within the maze. Just make sure you don&acirc;&euro;&trade;t fall under the pressure.<br /> <br /> My team has been working hard writing this adventure and would like to get feed back from experienced rpg players both familiar with the Dread system and not.",,Justin Beers,,,,,RPGA Table 4,,,,,,,,,,y
37,Commander Group Games!,Y,11/11/2016 7:00 PM,11/12/2016 12:00 AM,Card Game,,,"I will have multiple decks provided, for those who do not have edh magic decks. Once enough players are ready, a group game will commence.",,Jeff Lush,,,,,Gaming Table 1,,,,,,,,,,y
38,Weiss vs. Schwarz Demo,Y,11/11/2016 2:00 PM,11/11/2016 6:00 PM,Card Game,,,Come learn the fun anime themed collectible card game with Cassandra and Pat. There will be trial decks available to play with.,,Cassandra Nixon,,,,,Gaming Table 2,,,,,,,,,,y
39,Weiss vs Schwarz Demo,Y,11/12/2016 10:00 AM,11/12/2016 2:00 PM,Card Game,,,Missed the Friday session but still want to learn the fun anime themed collectible card game? Or maybe now that you know you want to practice your skills for the Sunday tournament? We are doing the demo again! Join us!,,Cassandra Nixon,,,,,Gaming Table 2,,,,,,,,,,y
4,Project Demonstrations and Playtesting,Y,11/12/2016 1:00 PM,11/12/2016 5:00 PM,Student Presentations,,,Presentations and playtesting of junior and senior projects by Dakota State University game design students.,,Steve Graham,,,,,Console Games,,,,,,,,Computer Game Design,,y
40,Weiss vs Schwarz Demo,Y,11/13/2016 10:00 AM,11/13/2016 3:00 PM,Card Game,,,"Now that you know the game or for seasoned players, come test your skills in our Sunday tournament. <br /> Anyone playing with Japanese langauge cards must have a translation list and a smart device so that cards can be looked up for newer players. Promo Rare prize support provided by Dragon's Den. <br /> Minimum of 6 players required for this tournament to run. This will be a title deck tournament.",,Cassandra Nixon,,,,,Gaming Table 2,,,,,,,,,,y
41,Cityskylines,Y,11/11/2016 3:00 PM,11/11/2016 5:00 PM,Computer Game,,,hwo long can the city survive,,Nick,,,,,Computer Games,,,,,,,,,,y
42,Betrayal at House on the Hill with widows walk,Y,11/12/2016 12:00 PM,11/12/2016 4:00 PM,Board Game,,,Play with you friends in a house of haunts . Build a house and try to escape it game plays 3-6 players,,Nick griffin,,,,,Gaming Table 4,,,,,,,,,,y
43,Flashbax 48 Commander Event,Y,11/11/2016 10:00 AM,11/11/2016 6:00 PM,Card Game,,,"Flashbax will be hosting a 48 hour MTG Commander event. We need min. of 8 people for this event. Each player must have a legal Commander Deck (WotC legal). Each player will play best 2 out of 3, no more than a total of 5 matches throughout the day. Each player may not play the same person more than 1 time a day. Points will be rewarded as follows: Loss=1, tie=2, win=3. Each player will get a free promotional card for participating. Top 3 will get very cool prizes as well.",,Erik Braley,,,,,Gaming Table 8,,,,,,,,Flashbax,,y
44,Keep talking and nobody explodes,Y,11/11/2016 6:00 PM,11/11/2016 10:00 PM,Computer Game,,,A game were 1 person looks at the boom and the rest at the bomb manual,,Nick griffin,,,,,Computer Games,,,,,,,,,,y
45,Iron Cosplay,Y,11/11/2016 2:00 PM,11/11/2016 5:00 PM,Panel,,,Join the DSU Anime club for our annual Iron Cosplay panel where participants will build their own costume using fabric and various recycle goods. Participants will make a costume based off a theme for a chance to win great anime prizesin this friendly competition!,,Bryce Blocker,,,,,Theater,,,,,,,,Anime Club,,y
46,New Anime 2016,Y,11/12/2016 4:00 PM,11/12/2016 5:00 PM,Panel,,,Come talk with Cassandra Tain about all the newest anime. This panel focuses on new anime that can supportively streamed from Crunchyroll and Hulu.,,Cassandra Nixon,,,,,Gaming Table 3,,,,,,,,,,y
47,We Be Goblins,Y,11/11/2016 3:00 PM,11/11/2016 7:00 PM,Role Playing,,,"We Be Goblins! is an adventure for 1st-level characters in which the PCs play a horde of malicious and murderous goblins, written for the Pathfinder Roleplaying Game and compatible with the 3.5 edition of the world's oldest RPG.",,Josh Pierce,,,,,RPGA Table 5,,,,,,,,Pathfinder Society,,y
48,We Be Goblins Too!,Y,11/12/2016 12:00 PM,11/12/2016 4:00 PM,Role Playing,,,"""We Be Goblins Too!"" is an adventure for four 3rd-level goblin characters, written for the Pathfinder Roleplaying Game and compatible with the 3.5 edition of the world's oldest roleplaying game.",,Josh Pierce,,,,,RPGA Table 5,,,,,,,,Pathfinder Society,,y
49,We Be Goblins Free!,Y,11/12/2016 5:00 PM,11/12/2016 9:00 PM,Role Playing,,,"We Be Goblins Free! is an adventure for four 4th-level goblin characters, written for the award-winning Pathfinder Roleplaying Game.",,Josh Pierce,,,,,RPGA Table 5,,,,,,,,Pathfinder Society,,y
5,Tear Down,Y,11/13/2016 5:00 PM,11/13/2016 8:00 PM,Tearing down,,,Tearing down Nanoncon,,Luther Johnson,,,,,General Gaming Area,,,,,,,,Nanocon,,y
50,We B4 Goblins,Y,11/13/2016 11:00 AM,11/13/2016 3:00 PM,Role Playing,,,"We B4 Goblins is an adventure for four goblin characters just beginning their careers of mischief and mayhem, written for the award-winning Pathfinder Roleplaying Game.",,Josh Pierce,,,,,RPGA Table 5,,,,,,,,Pathfinder Society,,y
51,Codenames,Y,11/11/2016 1:00 PM,11/11/2016 3:00 PM,Board Game,,,"Two rival spymasters know the secret identities of 25 agents. Their teammates know the agents only by their CODENAMES.<br /> <br /> In Codenames, two teams compete to see who can make contact with all of their agents first. Spymasters give one-word clues that can point to multiple words on the board. Their teammates try to guess words of the right color while avoiding those that belong to the opposing team. And everyone wants to avoid the assassin.<br /> <br /> Codenames: Win or lose, it's fun to figure out the clues.",,Rachel Groth,,,,,Gaming Table 5,,,,,,,,,,n
52,Delta Green - Last Things Last,Y,11/10/2016 5:00 PM,11/10/2016 7:30 PM,Role Playing,,,"The Unnatural is out there, and someone has to keep this green ball hurling through space safe. Delta Green are those people.<br /> <br /> Deception is a Right<br /> Truth is a Privilege<br /> Innocence is a Luxury",,Adam Larson,,,,,RPGA Table 4,,,,,,,,,,n
53,Delta Green - Last Things Last,Y,11/11/2016 4:00 PM,11/11/2016 7:00 PM,Role Playing,,,"The Unnatural is out there, and someone has to keep this green ball hurling through space safe. Delta Green are those people.<br /> <br /> Deception is a Right<br /> Truth is a Privilege<br /> Innocence is a Luxury",,Adam Larson,,,,,Gaming Table 4,,,,,,,,,,n
54,Delta Green,Y,11/12/2016 4:00 PM,11/12/2016 7:00 PM,Role Playing,,,"The Unnatural is out there, and someone has to keep this green ball hurling through space safe. Delta Green are those people.<br /> <br /> Deception is a Right<br /> Truth is a Privilege<br /> Innocence is a Luxury",,Adam Larson,,,,,RPGA Table 4,,,,,,,,,,n
55,Delta Green,Y,11/13/2016 4:00 PM,11/13/2016 7:00 PM,Role Playing,,,"The Unnatural is out there, and someone has to keep this green ball hurling through space safe. Delta Green are those people.<br /> <br /> Deception is a Right<br /> Truth is a Privilege<br /> Innocence is a Luxury",,Adam Larson,,,,,RPGA Table 4,,,,,,,,,,n
56,NaNoWriMo Mini-Prompt,Y,11/10/2016 6:00 PM,11/10/2016 7:00 PM,Exercise,,,"It is National Novel Writing Month, and many are furiously scratching pencil to paper. For those who love writing, who are looking to have a break, or who are looking to find others working on this lofty goal, this is the event for you! Paper and pencils will be provided, as well as a character design who will stand in as a loose prompt for those who need to get creative juices flowing. At the end of the hour, the character design will be given to whoever writes the most compelling backstory!",,Galacia,,,,,Gaming Table 1,,,,,,,,Galacia Barton,,n
57,Warhammer 40k,Y,11/12/2016 12:00 PM,11/12/2016 2:00 PM,Miniatures,,,Playing Warhammer 40K and talking about the game its mechanics and lore.,,Carl,,,,,Miniatures Area,,,,,,,,,,n
58,Mouse Guard,Y,11/12/2016 12:00 AM,11/12/2016 2:00 AM,Role Playing,,,"You play as a group of Mice of the Mouse Patrol working to keep the land safe from Predators, and to help solve other mousy problems",,Zene Huber,,,,,Gaming Table 2,,,,,,,,,,n
59,Mouse Guard,Y,11/13/2016 12:00 AM,11/13/2016 2:00 AM,Role Playing,,,"You are a group of Mice from the Mouse Patrol that protect the land from Predators, and help residents with issues that arise.",,Zene Huber,,,,,Gaming Table 2,,,,,,,,,,n
6,Persona 3 The Movie #1 Spring of Birth,Y,11/11/2016 10:00 PM,11/11/2016 11:30 PM,Anime,,,"Time counts down till the midnight hour and it's resolution, the time has come for Makoto to finish his saga. Will the world end or will he triumph over the apathy in humanity's heart? Movie showing of all four Persona 3 movies over the weekend.",,Tracy Booze,,,,,Speed Run Allayway,,,,,,,,,,y
60,Freeplay,Y,11/10/2016 6:00 PM,11/10/2016 10:00 PM,Video Game,,,"If there are no scheduled events here in Speedrun alley it is freeplay. We have a PS3, PSTV (Plays some vita games), and PS2 (If it deigns to work for us).<br /> <br /> Some games that will be in the the Alley: Journey, Bastion, Don't Starve: Giant's Edition, Dragon Fin Soup, The Cave (Digital)<br /> Muramasa (PSTV), Various Tales of games in the series, Project Diva F 2nd, Eternal Sonata and various others, come browse and sample, just ask the person currently playing if you can play one of the games. <br />",,Tracy Booze,,,,,Speed Run Allayway,,,,,,,,,,n
61,Lost Dimension,Y,11/11/2016 10:00 AM,11/11/2016 3:00 PM,Video Game,,,"Trapped in a tower with twelve other psychics, your goal, get to the top floor to stop your Enemy and the countdown to the bombs that will destroy the worlds population. The obstacle you have is that their is a traitor among you, can you find the right traitors? Or will you choose wrong and let the traitors through the judgment and if so, what consequences will that hold for you? (PS3, one player)",,Tracy Booze,,,,,Speed Run Allayway,,,,,,,,,,n
