event_key,name,active,event_start,event_end,event_type,event_subtype,seats,description,speakers,moderators,artists,sponsors,exhibitors,volunteers,venue,address,media_url,custom3,company,audience,subject,geo_area,tags,host_org,rsvp_url
1,Persona Midnight Event,Y,7/11/15 0:00,7/11/15 2:00,Persona,"Movie - Persona, Video Game",,"Join the Dark Hour in watching Persona 3 The Movie: : No. 2, Midsummer Knight's Dream. <br /><br />",,Tracy Booze,,,,,Speed Run Alleyway,,,,,,,,,,
10,Iron Cosplay,Y,7/11/15 15:00,7/11/15 17:30,Panel,"Anime, Panel",,Join the DSU Anime Club for our Annual Iron Cosplay Panel. Where you hand make a costume of your own imagination out of recyclable materials. This contest consists of teams to out build the others to win great prizes!,,Bryce Blocker,,,,,Theatre,,,,,,,,,Anime Club,
100,Paint and Take,Y,8/11/15 10:00,8/11/15 21:00,Miniatures,Miniatures,,"Come try your hand at painting a miniature. Paints, minis, brushes, and advice will all be available.",,Tucker Ramhorst,,,,,Paint and Take,,,,,,,,,,
101,Speed Paint,Y,8/11/15 14:00,8/11/15 15:00,Miniatures,Miniatures,,Speed painting contest. One hour for your best work on a figure supplied to you. Prizes for 1st and 2nd place.,,Tucker Ramhorst,,,,,Paint and Take,,,,,,,,,,
102,Painting Competition Judging,Y,8/11/15 16:00,8/11/15 17:00,Miniatures,Miniatures,,"Figures to be judged must be submitted prior to 3PM Sunday. Everyone welcome to come by and see what people have done. Prizes in categories: Science Fiction, Fantasy, and Large.",,Tucker Ramhorst,,,,,Paint and Take,,,,,,,,,,
103,Sushi Showdown,Y,7/11/15 14:00,7/11/15 15:00,Competition,Tournament,,Are you the fabled sushi master? Come and prove your mastery in a head to head contest against one another in the ultimate sushi challange down at Nanocon! Where fortune and honor are to be won!,,Bryce Blocker,,,,,Gaming Table 4,,,,,,,,,,
104,Play With Dyack,Y,7/11/15 15:00,7/11/15 18:00,,,,,Denis Dyack,,,,,,Gaming Table 5,,,,,,,,,,
105,Play With Dyack!,Y,8/11/15 15:00,8/11/15 18:00,,,,,Denis Dyack,,,,,,Gaming Table 5,,,,,,,,,,
11,Cthulhu: Gloom,Y,7/11/15 12:00,7/11/15 14:00,Card Game,"Card Game, Cthulhu",,"A transparent card game from Atlas Games<br /> <br /> From Dunwich to Innsmouth, from the halls of Miskatonic University to the Charles Dexter Ward at Arkham Sanitarium, trouble is in the air. The stars are almost right, and terrors from beyond space and time are beginning to break through. When Cthulhu rises, we're all doomed -- but whose downfall will be the most entertaining?<br /> <br /> In Cthulhu Gloom, you control a group of Lovecraftian protagonists and guide them down a path of horror and madness to an untimely death, while keeping your opponents happy, healthy, and annoyingly alive. While your characters Gibber With Ghouls and Learn Loathsome Lore to earn negative points, you'll encourage your opponents to be Analyzed by Alienists and to Just Forget About the Fungus to pile on positive points. When one group finally falls prey to the interdimensional doom that awaits us all, the player whose characters have suffered the most wins.<br /> <br /> Cthulhu Gloom is printed on transparent plastic cards. Multiple Modifier cards can be played on top of the same Character card; since the cards are transparent, elements from previously played Modifier cards either show through or are obscured by those played above them. You can immediately and easily see the point value of every character, no matter how many Modifiers they have piled on.<br /> <br /> Cthulhu Gloom is a stand-alone card game that's also fully compatible with Gloom and its expansions. It introduces Story cards and Transformation cards.<br /> <br /> One or more Story cards can be placed face up on the table at the start of the game; the first player to meet the conditions of a card -- drawing the attention of The King in Yellow or heeding The Call of Cthulhu, for example -- can claim it and gain the benefits it lists.<br /> <br /> Transformation cards have ongoing effects that remain with a character throughout his life, along with a picture that replaces the character's original art with something hideous and slimy; when you've Felt Rather Fishy or been Minced by Mi-Go, the squamous results aren't easily forgotten!<br />",,Chad Keifer,,,,,Gaming Table 3,,,,,,,,,,
12,Archer: the Danger Zone! Board game,Y,7/11/15 14:30,7/11/15 15:30,Board Game,"Archer, Board Game",,"Archer The Danger Zone! Board Game: A high-stakes game of espionage, international intrigue, and screwing over your co-workers.<br /> <br /> The object of the game is to gain the Upper Hand over your opponents by insulting them, doing well on missions (quite the ego boost), and encountering random guest stars and secondary characters from the show. Each player starts with 5 Upper Hand. The first player to get to 20 Upper Hand wins the game.<br /> <br /> Each player chooses one of the following characters to play: Archer, Lana, Malory, Cyril, Pam, Cheryl, Ray or Dr. Krieger. The insults and dirty tricks you deliver to the other players are based on actual quotes from the show that your character makes. The cards in your unique deck of 20 cards give you the ability to hurl insults, &acirc;&euro;&oelig;come on&acirc;&euro;ù to another character, or say something that builds up your character&acirc;&euro;&trade;s own ego.<br /> <br /> The action takes place at the ISIS Headquarters, though spy missions send the gang off to exotic locales each round of play. The game features 6 important office locations within ISIS, but you (typically) play with around 4 of them, making each game play out very differently as the &acirc;&euro;&oelig;Office Map&acirc;&euro;ù will be vary from game to game. Each location does something different, but only the first person to go to each location each round gets the benefit listed on that location. Surely there will be no name calling when another player beats you to the punch!<br /> <br /> The game is all about other players ticking you off and wanting to get the better of them.<br /> <br /> There are naturally plenty of opportunities to belittle your co-workers while in the office and out in the field. Doing so will knock them down a peg or two on the Upper Hand track.<br /> <br /> It all adds up to a humorously good time!",,Chad Keifer,,,,,Gaming Table 2,,,,,,,,,,
13,Gloom!,Y,7/11/15 16:00,7/11/15 18:00,Card Game,"Card Game, Gloom",,"<br /> The world of Gloom is a sad and benighted place. The sky is gray, the tea is cold, and a new tragedy lies around every corner. Debt, disease, heartache, and packs of rabid flesh-eating mice -- just when it seems like things can't get any worse, they do. But some say that one's reward in the afterlife is based on the misery endured in life. If so, there may yet be hope -- if not in this world, then in the peace that lies beyond.<br /> <br /> In the Gloom card game, you assume control of the fate of an eccentric family of misfits and misanthropes. The goal of the game is sad, but simple: you want your characters to suffer the greatest tragedies possible before passing on to the well-deserved respite of death. You'll play horrible mishaps like Pursued by Poodles or Mocked by Midgets on your own characters to lower their Self-Worth scores, while trying to cheer your opponents' characters with marriages and other happy occasions that pile on positive points. The player with the lowest total Family Value wins.<br /> <br /> Printed on transparent plastic cards, Gloom features an innovative design by noted RPG author Keith Baker. Multiple modifier cards can be played on top of the same character card; since the cards are transparent, elements from previously played modifier cards either show through or are obscured by those played above them. You'll immediately and easily know the worth of every character, no matter how many modifiers they have. You've got to see (through) this game to believe it!<br />",,Chad Keifer,,,,,Gaming Table 3,,,,,,,,,,
14,Horus Heresy: Victory is Vengeance,Y,8/11/15 12:00,8/11/15 16:00,Miniatures,"Horus Heresy, Miniatures",,"Planetwide operations weren&acirc;&euro;&trade;t the only type of battle being waged by the infighting legions during the Heresy. Amongst the ruins of the Choral City and Siren Hold, the benighted caverns of Calth or the volcanic crags of Istvaan V small bands of Astartes hunted each other down mercilessly. This is war- fare distilled down into its most bitter form, where death is a guarantee and the only thing driving day to day existence is to deliver vengeance upon your foes.<br /> <br /> Scrounge an extra clip for your bolter, check your armor seals and gather the few remaining loyal brothers to your side as you prepare to do battle on a personal scale! Before the event play- ers will be split into Survivors and Exterminators. Throughout the day VPs will be tallied and one side will be declared the victor.<br /> <br /> During this event you will play 3 games on battlefields cluttered with ruins or close corridor environs. Gameplay will be more focused on movement and outmaneuvering your opponent before driving home the killing blow. All the while you&acirc;&euro;&trade;ll need to gather supply points to upkeep your weaponry and armor between games.<br /> <br /> This is a Horus Heresy specific variant utilizing the Tactical Strike rules. As such, it requires the use of the Forge World Horus Heresy Books. In particular pages 166-177 of Book 3. Players will need to be quite familiar with this variant ruleset.<br /> <br /> What makes Tactical Strike unique is that models are pur- chased on an individual basis, allowing you to create a force of mixed legions armed with an eclectic array of weaponry. Each participant will have 3 army lists prepared at 200, 250 and 300 point levels. In addition players may choose up to 3 characters from a separate pool of 150 points. This force will be generated from Horus Heresy Books 1-4.<br /> <br /> Play aids will be made available to speed up and clarify play. Please email erraneous@gmail.com for all players pack requests.",,Chad Keifer,,,,,Miniatures,,,,,,,,,,
15,Persona Recap Event,Y,6/11/15 22:00,7/11/15 0:00,Anime,"Anime, Video Game",,We will be watching Persona 3 The Movie 1: Spring of Birth as a recap from last year.<br /> <br /> (Speed Run Alley),,Tracy Booze,,,,,Speed Run Alleyway,,,,,,,,,,
16,D&D organized Play,Y,6/11/15 19:00,7/11/15 0:00,Role Playing,organized play,,Organized Dungeons and Dragons Next.,,Glenn Berman,,,,,RPGA Table 2,,,,,,,,,,
17,D&D organized Play,Y,7/11/15 9:00,7/11/15 14:00,Role Playing,organized play,,Organized play for Dungeons and Dragons Next.,,Glenn Berman,,,,,RPG Area,,,,,,,,,,
18,D&D organized Play,Y,7/11/15 14:00,7/11/15 19:00,Role Playing,organized play,,Organized play for D&D Next,,Glenn Berman,,,,,RPG Area,,,,,,,,,,
19,D&D organized Play,Y,7/11/15 19:00,8/11/15 0:00,Role Playing,organized play,,Organized play for D&D Next,,Glenn Berman,,,,,RPG Area,,,,,,,,,,
2,Flashbax RPG Clinic,Y,7/11/15 17:00,8/11/15 2:00,Role Playing,Presentation,,I would like to host a basic A&A style open forum to help players with issues running or playing in campaigns. We would give advice or input to help them further they play styles and find solutions for situations that have caused issues.,,Erik Braley,,,,,RPGA Table 2,,,,,,,,,Flashbax,
20,D&D organized Play,Y,8/11/15 9:00,8/11/15 14:00,Role Playing,organized play,,Organized play for D&D next,,Glenn Berman,,,,,RPG Area,,,,,,,,,,
21,D&D organized Play,Y,8/11/15 14:00,8/11/15 19:00,Role Playing,organized play,,Organized play for D&D Next,,Glenn Berman,,,,,RPG Area,,,,,,,,,,
22,Gauntlet,Y,7/11/15 21:00,7/11/15 23:00,Computer Game,Video Game,,"Extra Life stream of playing Gauntlet on PC. If you have your own rig and copy of the game you are welcome to join in that way, otherwise shared screen is an allowed option with this game (This means you don't need to bring anything to play)",,Matt Nelles,,,,,Gaming Table 2,,,,,,,,,Voidware Gaming,
23,PayDay 2,Y,6/11/15 23:00,7/11/15 1:00,Computer Game,Video Game,,Getting a group of 4 people together to play PayDay 2. (This event may require you to bring your own PC and own your own copy of the game),,Matt Nelles,,,,,Gaming Table 1,,,,,,,,,Voidware Gaming,
24,Samurai Spirts,Y,6/11/15 19:00,6/11/15 21:00,Board Game,"Board Game, Card Game",,Like the movie Seven Samurai. Then come play the game Samurai Spirits. Were you and seven team mates must battle a band of raiders from destroying a village. Work together and unleash your animal spirit.,,Gary Utecht,,,,,Gaming Table 2,,,,,,,,,,
25,Legends Of DnD,Y,6/11/15 17:00,6/11/15 23:00,Role Playing,Role Playing,,A Home-brewed 3.5 DnD Table Top RPG.... with LEGENDS OF ZELDA?!?!?!?<br /> <br /> Absolutely that. I game with a story line and realm of Legends of Zelda with the RP style of DnD.<br /> <br /> The best of both worlds designed to immerse the players in a realm of imagination,,Tristan (Skittle),,,,,RPG Area,,,,,,,,,,
26,Tales of Zesteria Marathon,Y,7/11/15 10:00,8/11/15 10:00,Video Game,Video Game,,"Newly released, we are going to see how far we can get in Tales of Zesteria (PS4 version). Yes, we know, we are crazy, let the Tales begin.",,Tracy Booze,,,,,Speed Run Alleyway,,,,,,,,,,
27,Don't Starve Together,Y,7/11/15 17:00,8/11/15 0:00,Computer Game,Video Game,,"Join us on an epic adventure in a world only Tim Burton and Lovecraft could fathom! In this world, starving is the least of your worries as you struggle to survive the elements and creatures the lurk around every corner.",,Scarlet Heberlig,,,,,Gaming Table 1,,,,,,,,,Voidware Gaming,
28,LoZ Dungeons & Dragons,Y,6/11/15 17:00,6/11/15 23:00,Role Playing,Dungeons & Dragons,,Legend of Zelda tabletop RPG using D&D format rules/system. Bring your dice and your adventurer's pack!,,Tristan Shippert,,,,,RPGA Table 1,,,,,,,,,,
29,MTG EDH Design Challenge - Will of the Council,Y,7/11/15 14:00,7/11/15 15:30,Game Design,Card Game,,"Elder Dragon Highlander - one of the most iconic formats of Magic: The Gathering, featuring a deck constructed with 100 singleton cards around a specific 'General' that defines the colors you must construct with. <br /> <br /> While many legendary creatures exist for you to build a deck around, have you ever wanted to design your very own 'EDH General'?<br /> <br /> Here's your chance! Five seats exist, where you may sit down and become one of the members of 'The Council'. All council members will brainstorm and design an EDH General, which will be brought back to vote on whether the created creature is thematic and awesome or just plain broken.<br /> <br /> If your design is chosen to be worthy by the Council, it may have a chance to be offered in DSU's regular EDH League, for others to play! <br /> <br /> Get your game design on, and help shape some of the generals that we all know Wizards of the Coast has been too afraid to make.",,Galacia Barton,,,,,Gaming Table 3,,,,,,,,,DSU EDH League,
3,X-Wing Escalation,Y,7/11/15 9:00,7/11/15 10:00,Miniatures,Tournament,,First round of an X-Wing Miniatures Escalation Tournament. <br /> Participants are expected to bring all the materials needed to play. Please bring a mat if you are able.<br /> <br /> Using the Offical Rules: https://images-cdn.fantasyflightgames.com/filer_public/c7/6f/c76f220b-5efd-4afc-912b-e67dfcda034e/x-wing_escalationrules_v301.pdf,,Jeremy Haugen,,,,,Miniatures,,,,,,,,,,
30,Society in Shadow LARP,N,6/11/15 17:00,6/11/15 17:00,LARP,"Role Playing, Interactive Role Playing",,Friday Night - <br /> 4:00 pm - GO Huddle <br /> 5:00 pm - Game on!<br /> 7:00 pm - Dinner will be ready<br /> 1:00 am - GO Huddle - Break from ongoing scene and return if necessary<br /> 2:00 am - Hard stop for game<br /> GO Curfew is 3:00 am for those at Break of Dawn on Saturday<br /> <br /> <br /> Saturday -<br /> 12:00 pm - Break of Dawn - Check ‚ÄòInto the Void‚Äô > Daybreak Ritual for player pull list<br /> 6:00 pm - Dinner Break<br /> 1:00 am - GO Huddle - Break from ongoing scene and return if necessary<br /> 2:00 am - Hard stop for game<br /> GO Curfew is 3:00 am for those at Break of Dawn on Sunday<br /> <br /> <br /> Sunday -<br /> 12:00 pm - Break of Dawn<br /> 4:00 pm - Game Called - GO Huddle<br /> 5:30 pm - Awards<br /> <br /> 3 round x 6 chairs (per usual)<br /> 3 8ft long tables and the one short one (per usual),,Zach Beerman,,,,,General Gaming Area,,,,,,,,,,
31,Over Night Axis and Allies,Y,7/11/15 23:59,8/11/15 7:59,Board Game,"Board Game, Miniatures",,What better way to spend a Saturday night than to take over the world.,,Zene Huber,,,,,Gaming Table 2,,,,,,,,,,
32,Super Smash Bros. Wii U Tournament,Y,7/11/15 17:00,7/11/15 19:00,Video Game,Video Game,,"Come Smash it up against other competitors in the Smash Bros. Wii U tournament! Gamecube controllers will be provided, but you will need to bring your own controller if you prefer other types of controller.",,Skyler Wittmer,,,,,Video Game Alleyway,,,,,,,,,,
33,Keep Talking And Nobody Explodes,Y,7/11/15 14:03,7/11/15 16:03,Computer Game,"Computer Game, Interactive Role Playing, Video Game",,"Ever wish you could defuse a bomb, well here is your opportunity. In this game one person is diffusing a bomb while the others are explaining how to do this with a manual. This game can have as many participants as it wants. Also uses the Oculus Rift for diffusing the bomb.",,Bizkit,,,,,Gaming Table 1,,,,,,,,,Voidware Gaming,
34,Extra Life,N,6/11/15 19:00,7/11/15 19:00,Charity Event,"Board Game, Card Game, Computer Game, Miniatures, Role Playing, Video Game",,Extra Life is a 24 hour charity gaming streaming event held every year to raise money for children's miracle network. We are turning this into a Nanocon long event this year!!,,Matthew Nelles,,,,,Gaming Table 1,,,,,,,,,Voidware Gaming,
35,Super Smash Bros. Wii U Amiibo Tournament,Y,7/11/15 20:00,7/11/15 22:00,Video Game,Video Game,,"Do you feel like your Amiibo is the best it can be? Come test its mettle at Nanocon's Smash for Wii U Amiibo Tournament!<br /> <br /> Notes: This is not like the Screwattack Amiibo Cockfight if you've heard of that, so don't worry, your Amiibo is safe from harm!<br /> Also, if we have enough Amiibos, perhaps a couple 8-Amiibo Smash games can place?",,Skyler Wittmer,,,,,Video Game Alleyway,,,,,,,,,,
36,Boss Monster,Y,8/11/15 11:00,8/11/15 12:00,Card Game,Card Game,,Session of Boss Monsters card game.,,Zachary Truesdell,,,,,Gaming Table 2,,,,,,,,,,
37,Game of Thrones the Board Game,Y,7/11/15 9:30,7/11/15 12:30,Board Game,Board Game,,Session of Game of Thrones the Board Game.,,Zachary Truesdell,,,,,Gaming Table 1,,,,,,,,,,
38,FireFly - The Board Game,Y,7/11/15 14:00,7/11/15 18:00,Board Game,"Board Game, Card Game",,"FireFly the board game, is a game where you play a ships captain from the FireFly series. You attempt to complete a series of missions, earning money, crewmembers and street cred. Find a Ship, Get a Crew, and Keep Flying.<br /> <br /> We would be playing with all the expansions, except we would not be using the Player v. Player rules. I would Oversee the game and make final decisions on questions, and would assist new players in getting started. We would have room for up to 9 players. I would be playing the Blitz rules which gets the game going quickly.",,Matthew Betzen,,,,,Gaming Table 5,,,,,,,,,,
39,Society in Shadow LARP Session 1,Y,6/11/15 17:00,7/11/15 3:00,LARP,"Interactive Role Playing, Role Playing",,Friday Night - <br /> 4:00 pm - GO Huddle <br /> 5:00 pm - Game on!<br /> 7:00 pm - Dinner will be ready<br /> 1:00 am - GO Huddle - Break from ongoing scene and return if necessary<br /> 2:00 am - Hard stop for game<br /> GO Curfew is 3:00 am for those at Break of Dawn on Saturday,,Zach Beerman,,,,,General Gaming Area,,,,,,,,,The Organization,
4,X-Wing Escalation,Y,7/11/15 10:00,7/11/15 11:30,Miniatures,Tournament,,Second round of an X-Wing Miniatures Escalation Tournament. <br /> Participants are expected to bring all the materials needed to play. Please bring a mat if you are able.<br /> <br /> Using the Offical Rules: https://images-cdn.fantasyflightgames.com/filer_public/c7/6f/c76f220b-5efd-4afc-912b-e67dfcda034e/x-wing_escalationrules_v301.pdf,,Jeremy Haugen,,,,,Miniatures,,,,,,,,,,
40,Society in Shadow LARP Session 2,Y,7/11/15 12:00,8/11/15 3:00,LARP,"Role Playing, Interactive Role Playing",,Saturday -<br /> 12:00 pm - Break of Dawn - Check ‚ÄòInto the Void‚Äô > Daybreak Ritual for player pull list<br /> 6:00 pm - Dinner Break<br /> 1:00 am - GO Huddle - Break from ongoing scene and return if necessary<br /> 2:00 am - Hard stop for game<br /> GO Curfew is 3:00 am for those at Break of Dawn on Sunday,,Zach Beerman,,,,,General Gaming Area,,,,,,,,,The Organization,
41,Society in Shadow LARP Session 3,Y,8/11/15 12:00,8/11/15 18:00,LARP,"Role Playing, Interactive Role Playing",,Sunday -<br /> 12:00 pm - Break of Dawn<br /> 4:00 pm - Game Called - GO Huddle<br /> 5:30 pm - Awards,,Zach Beerman,,,,,General Gaming Area,,,,,,,,,The Organization,
42,The Wonders of the Occult,Y,6/11/15 18:00,6/11/15 19:00,Panel,Panel,,"This panel covers the topic of occult, the different types, how it has evolves, and how it influences video games and other entertainment today.",,Lina Love,,,,,Gaming Table 4,,,,,,,,,,
43,Boss Monster,Y,7/11/15 17:00,7/11/15 17:30,Card Game,"Board Game, Card Game",,"Inspired by a love of classic video games, Boss Monster: The Dungeon Building Card Game pits 2-4 players in a competition to build the ultimate side-scrolling dungeon. Players compete to lure and destroy hapless adventurers, racing to outbid one another to see who can build the most enticing, treasure-filled dungeon. The goal of Boss Monster is to be the first Boss to amass ten Souls, which are gained when a Hero is lured and defeated &acirc;&euro;"" but a player can lose if his Boss takes five Wounds from Heroes who survive his dungeon.",,Sergio A Mendez,,,,,Gaming Table 2,,,,,,,,,,
44,Seven Wonders,Y,6/11/15 18:00,6/11/15 19:00,Card Game,"Board Game, Card Game",,"You are the leader of one of the 7 great cities of the Ancient World. Gather resources, develop commercial routes, and affirm your military supremacy. Build your city and erect an architectural wonder which will transcend future times.",,Sergio A Mendez,,,,,Gaming Table 2,,,,,,,,,,
45,Zombie Dice,Y,7/11/15 14:00,7/11/15 14:30,Board Game,Board Game,,Eat brains. Don't get shotgunned.,,Sergio A Mendez,,,,,Gaming Table 2,,,,,,,,,,
46,Betrayal at House on the Hill,Y,7/11/15 19:00,7/11/15 20:30,Board Game,Board Game,,"Betrayal at House on the Hill quickly builds suspense and excitement as players explore a haunted mansion of their own design, encountering spirits and frightening omens that foretell their fate. With an estimated one hour playing time, Betrayal at House on the Hill is ideal for parties, family gatherings or casual fun with friends.",,Sergio A Mendez,,,,,Gaming Table 2,,,,,,,,,,
47,Pathfinder Module: We Be Goblins,Y,7/11/15 10:00,7/11/15 14:00,Role Playing,"Board Game, Miniatures",,"A most unusual adventure for 1st-level goblin characters.<br /> <br /> The Licktoad goblins of Brinestump Marsh have stumbled upon a great treasure&acirc;&euro;""fireworks! Yet unfortunately for them, the tribe member responsible for the discovery has already been exiled for the abhorrent crime of writing (which every goblin knows steals words from your head). To remedy this situation, the Licktoads&acirc;&euro;&trade; leader, His Mighty Girthness Chief Rendwattle Gutwad, has declared that the greatest heroes of the tribe must venture forth to retrieve the rest of the fireworks from a derelict ship stranded in the marsh. In order to prove themselves as the Licktoads&acirc;&euro;&trade; bravest goblins, the PCs must complete a series of dangerous dares, from swallowing bull slugs and braving the dreaded Earbiter to dancing with Squealy Nord himself. Yet even once they&acirc;&euro;&trade;ve proven their mettle, the adventure is just beginning. For the ship in question is far from uninhabited, and Vorka the cannibal goblin would like nothing better than a few tasty visitors....<br /> <br /> We Be Goblins! is an adventure for 1st-level characters in which the PCs play a horde of malicious and murderous goblins, written for the Pathfinder Roleplaying Game and compatible with the 3.5 edition of the world's oldest RPG. The adventure takes place outside the town of Sandpoint in the Pathfinder campaign setting, but can easily be adapted for any campaign world. It also serves as a preview of Pathfinder Player Companion: Goblins of Golarion, and as an optional prequel to Pathfinder Adventure Path's upcoming Jade Regent Adventure Path.",,Josh Pierce,,,,,RPGA Table 1,,,,,,,,,Pathfinder Society,
